rule_id;rule_type;pattern;severity;comment
R001;required;срок;Критично;Должен быть указан срок действия договора
R002;required;ответственность;Критично;Должен быть раздел об ответственности сторон
R003;required;реквизиты;Критично;Должны быть указаны реквизиты сторон
R004;required;предмет договора;Важно;Должен быть описан предмет договора
R005;required;порядок оплаты;Важно;Должны быть описаны условия оплаты
RISK001;risk;в одностороннем порядке;Критично;Односторонние изменения условий — высокий риск
RISK002;risk;без уведомления;Критично;Отсутствие уведомления при изменениях — высокий риск
RISK003;risk;не несёт ответственности;Важно;Полное освобождение от ответственности — риск
RISK004;risk;в любое время;Низкий;Размытая формулировка сроков — низкий риск